{
  "work_order_type": "update_telco_customer",
  "description": "电信客户数据表-根据客户唯一标识ID更新月费金额。入参的customerID是客户id，new_price是月费金额",
  "steps": [
    {
      "step": 1,
      "operation": "QUERY",
      "table": "telco_customer",
      "where": "customerID = {customerID}",
      "output_fields": ["customerID"]
    },
    {
      "step": 2,
      "operation": "GENERATE_DML",
      "type": "UPDATE",
      "table": "telco_customer",
      "set": {
        "MonthlyCharges": "{new_price}"
      },
      "where": "customerID = {customerID}"
    }
  ],
  "final_sql_template": "UPDATE telco_customer SET MonthlyCharges = ? WHERE customerID = ?"
}
